{
 "spec_id": "c03-accelerating-dual-momentum-60",
 "schema_version": "1.1",
 "source": {
  "post_url": "https://stock79.tistory.com/entry/%EC%8B%A4%EC%A0%84-%ED%88%AC%EC%9E%90-%EC%A0%84%EB%9E%B5-60-Accelerating-dual-momentum",
  "post_title": "실전 투자 전략 (60) - Accelerating dual momentum",
  "category": "column_strategy",
  "published_at": "2018-09-28",
  "archived_path": "data/archive/posts/실전-투자-전략-60-Accelerating-dual-momentum.html",
  "content_hash": "c2bd2ab9b2acb3a1a8faafeabf29642778a852ad5407a45429a82273dbb3a458",
  "image_count": 4,
  "text_only_reproducible": true,
  "related_posts": []
 },
 "scope": {
  "track": "native_overseas",
  "track_reason": "원문 유니버스가 미국 ETF (SPY/SCZ/TLT/TIP). 2018-09 발행 → OOS(2019~)가 가장 깨끗",
  "survivorship_risk": "low",
  "m4_reproduction_eligible": true
 },
 "review_status": {
  "status": "ready_for_backtest",
  "reasons": [
   "2026-08-26 사용자 승인 (M2 확정, '추천대로')"
  ],
  "blocking_questions": [],
  "reviewed_by_human": true
 },
 "strategy": {
  "name": {
   "value": "Accelerating dual momentum",
   "source_quote": "실전 투자 전략 (60) - Accelerating dual momentum",
   "source_locator": "title",
   "confidence": "high",
   "assumption_needed": false,
   "question_for_user": null
  },
  "core_idea": {
   "value": "1·3·6개월 평균 모멘텀으로 SPY/SCZ 중 승자를 고르고, 음수면 TLT/TIP 중 1개월 수익률 상위 자산으로 대피",
   "source_quote": "상대적으로 긴 모멘텀 산출값 대신 짧은 모멘텀 값을 이용함으로써, 시장 변화에 더 기민하게 대응한다는 의미",
   "source_locator": "H1:개요",
   "confidence": "high",
   "assumption_needed": false,
   "question_for_user": null
  },
  "strategy_type": {
   "value": "momentum",
   "source_quote": "매월 말, SPY와 SCZ의 1,3,6 개월 모멘텀 (1,3,6 개월 수익률)의 평균을 구하여 비교한다.",
   "source_locator": "H2:매매 로직",
   "confidence": "medium",
   "assumption_needed": false,
   "question_for_user": null
  },
  "asset_class": {
   "value": "US/intl ETF (equity, treasury, TIPS)",
   "source_quote": "1) 유니버스 : SPY(S&&P500), SCZ(international small cap 주식), TLT(미국 20년 만기 국채), TIP(미국 물가연동국채, 현금성 안전자산)",
   "source_locator": "H2:유니버스",
   "confidence": "high",
   "assumption_needed": false,
   "question_for_user": null
  },
  "market_in_post": {
   "value": "US/GLOBAL",
   "source_quote": "1) 유니버스 : SPY(S&&P500), SCZ(international small cap 주식), TLT(미국 20년 만기 국채), TIP(미국 물가연동국채, 현금성 안전자산)",
   "source_locator": "H2:유니버스",
   "confidence": "medium",
   "assumption_needed": false,
   "question_for_user": null
  },
  "universe": {
   "selection_rule": {
    "value": [
     "SPY",
     "SCZ",
     "TLT",
     "TIP"
    ],
    "source_quote": "1) 유니버스 : SPY(S&&P500), SCZ(international small cap 주식), TLT(미국 20년 만기 국채), TIP(미국 물가연동국채, 현금성 안전자산)",
    "source_locator": "H2:유니버스",
    "confidence": "high",
    "assumption_needed": false,
    "question_for_user": null
   },
   "position_count": {
    "value": 1,
    "source_quote": "두 자산 중 평균 모멘텀 값이 큰 것을 선택한다.",
    "source_locator": "H2:매매 로직",
    "confidence": "medium",
    "assumption_needed": false,
    "question_for_user": null
   },
   "includes_etf": {
    "value": true,
    "source_quote": "1) 유니버스 : SPY(S&&P500), SCZ(international small cap 주식), TLT(미국 20년 만기 국채), TIP(미국 물가연동국채, 현금성 안전자산)",
    "source_locator": "H2:유니버스",
    "confidence": "medium",
    "assumption_needed": false,
    "question_for_user": null
   },
   "delisting_handling": {
    "value": null,
    "source_quote": null,
    "source_locator": null,
    "confidence": "none",
    "assumption_needed": true,
    "question_for_user": "원문 언급 없음. 엔진 기본 동작 적용 승인?"
   },
   "ticker_mapping": [],
   "unmapped_assets": [],
   "resolved_tickers": [
    "SPY",
    "SCZ",
    "TLT",
    "TIP"
   ]
  },
  "signals": {
   "entry": [
    {
     "rule_text": {
      "value": "SPY vs SCZ 1·3·6개월 평균 모멘텀 승자 선택, 양수면 매수",
      "source_quote": "해당 자산의 평균 모멘텀 > 0 인 경우 월말에 해당 자산 매수",
      "source_locator": "H2:매매 로직",
      "confidence": "high",
      "assumption_needed": false,
      "question_for_user": null
     },
     "indicator": {
      "value": "mean of 1/3/6M returns",
      "source_quote": "매월 말, SPY와 SCZ의 1,3,6 개월 모멘텀 (1,3,6 개월 수익률)의 평균을 구하여 비교한다.",
      "source_locator": "H2:매매 로직",
      "confidence": "high",
      "assumption_needed": false,
      "question_for_user": null
     },
     "lookback_period": {
      "value": "1,3,6 months",
      "source_quote": "매월 말, SPY와 SCZ의 1,3,6 개월 모멘텀 (1,3,6 개월 수익률)의 평균을 구하여 비교한다.",
      "source_locator": "H2:매매 로직",
      "confidence": "high",
      "assumption_needed": false,
      "question_for_user": null
     },
     "threshold": {
      "value": 0,
      "source_quote": "해당 자산의 평균 모멘텀 > 0 인 경우 월말에 해당 자산 매수",
      "source_locator": "H2:매매 로직",
      "confidence": "high",
      "assumption_needed": false,
      "question_for_user": null
     }
    }
   ],
   "exit": [
    {
     "rule_text": {
      "value": "평균 모멘텀 음수면 TLT/TIP 중 최근 1개월 수익률 상위 자산으로 교체",
      "source_quote": "해당 자산의 평균 모멘텀 < 0 인 경우, TLT와 TIP 중 최근 1개월 수익률이 높은 자산 매수",
      "source_locator": "H2:매매 로직",
      "confidence": "high",
      "assumption_needed": false,
      "question_for_user": null
     }
    }
   ],
   "signal_to_execution_lag": {
    "value": null,
    "source_quote": null,
    "source_locator": null,
    "confidence": "none",
    "assumption_needed": true,
    "question_for_user": "'월말에 매수'가 당일 종가인지 익일인지 미명시. 엔진 기본(익일 시가) 적용 승인?"
   }
  },
  "sizing": {
   "method": {
    "value": "100% single asset",
    "source_quote": "두 자산 중 평균 모멘텀 값이 큰 것을 선택한다.",
    "source_locator": "H2:매매 로직",
    "confidence": "medium",
    "assumption_needed": false,
    "question_for_user": null
   },
   "cash_handling": {
    "value": "방어 시 TLT 또는 TIP 100%",
    "source_quote": "해당 자산의 평균 모멘텀 < 0 인 경우, TLT와 TIP 중 최근 1개월 수익률이 높은 자산 매수",
    "source_locator": "H2:매매 로직",
    "confidence": "medium",
    "assumption_needed": false,
    "question_for_user": null
   }
  },
  "rebalance": {
   "frequency": {
    "value": "monthly",
    "source_quote": "매월 말 반복",
    "source_locator": "H2:매매 로직",
    "confidence": "high",
    "assumption_needed": false,
    "question_for_user": null
   },
   "timing": {
    "value": "month-end",
    "source_quote": "매월 말 반복",
    "source_locator": "H2:매매 로직",
    "confidence": "high",
    "assumption_needed": false,
    "question_for_user": null
   }
  }
 },
 "reported_performance": {
  "evidence_type": "image_only",
  "other_metrics": {
   "value": null,
   "source_quote": null,
   "source_locator": null,
   "confidence": "none",
   "assumption_needed": true,
   "question_for_user": "원문 성과 수치가 이미지에만 존재. M4는 외부 공개 구현(engineeredportfolio ADM) 수치와의 정합성 확인으로 대체 승인?"
  }
 },
 "validation_plan": {
  "in_sample_end": "2018-12-31",
  "oos_start": "2019-01-01",
  "benchmark": "SPY",
  "data_source": "yfinance",
  "base_currency": "USD",
  "in_sample_reproduction_applicable": true,
  "known_data_gaps": [
   "SCZ 상장 2007-12 — 인샘플 시작일 제약"
  ]
 },
 "open_questions": [
  {
   "field_path": "reported_performance",
   "question": "원문 수치 이미지 — M4 대조 기준을 외부 공개 수치로 대체?",
   "recommended_default": "외부 공개 구현 수치와 정합성 확인",
   "blocking": false
  }
 ]
}